{
  "$schema": "https://json-schema.org/draft/2020-12/schema",
  "artifacts": [
    {
      "bytes": 969,
      "replay_id": null,
      "repository_path": "conformance/ihp-inverter/semantic-contract.json",
      "role": "contract-test",
      "sha256": "312e0c1bded8abfb5bdd404767c9bc26ea3559d8260920b67b0045ba5314baa5",
      "source_output": "contract-test-verdict",
      "source_step": "contract-tests"
    },
    {
      "bytes": 1315,
      "replay_id": null,
      "repository_path": "conformance/ihp-inverter/semantic-artifacts/design-provenance.json",
      "role": "design-provenance",
      "sha256": "28996132385569dcc842fc4639cfcfdcf228c36c629c846b23a5474464302b81",
      "source_output": "design-provenance",
      "source_step": "materialize-pinned-sources"
    },
    {
      "bytes": 1739,
      "replay_id": null,
      "repository_path": "conformance/ihp-inverter/semantic-artifacts/run.json",
      "role": "native-artifact",
      "sha256": "0249f397cebf8ae9135be125e8975e4a72ce933d72defdf832960ba430e680d4",
      "source_output": "native-run-receipt",
      "source_step": "drc-clean"
    },
    {
      "bytes": 9670,
      "replay_id": null,
      "repository_path": "conformance/ihp-inverter/semantic-artifacts/drc.json",
      "role": "native-artifact",
      "sha256": "2bd1fafb552de22201feffaf14da298076eeebb88a5e5f598afa998123fe5c34",
      "source_output": "clean-drc-result",
      "source_step": "drc-clean"
    },
    {
      "bytes": 120878,
      "replay_id": null,
      "repository_path": "conformance/ihp-inverter/semantic-artifacts/inverter.drc.lyrdb",
      "role": "native-artifact",
      "sha256": "52d617caa4d63a49ca8adb94f13b56e8a195d4acf94de79d40c5297914baa6a3",
      "source_output": "clean-drc-lyrdb",
      "source_step": "drc-clean"
    },
    {
      "bytes": 12218,
      "replay_id": null,
      "repository_path": "conformance/ihp-inverter/semantic-artifacts/inverter.drc.lyrdb.openada.log",
      "role": "native-artifact",
      "sha256": "c4f07dce6e492928fe13b06223c7915bf64b8f564791424c37d59417b9656573",
      "source_output": "clean-drc-transcript",
      "source_step": "drc-clean"
    },
    {
      "bytes": 17266,
      "replay_id": null,
      "repository_path": "conformance/ihp-inverter/semantic-artifacts/drc-fail.json",
      "role": "native-artifact",
      "sha256": "39ee9f3845452158195b8eaf1ccd142217a4872e1ae79e26e537bfa76c18b478",
      "source_output": "failing-drc-result",
      "source_step": "drc-fail"
    },
    {
      "bytes": 123327,
      "replay_id": null,
      "repository_path": "conformance/ihp-inverter/semantic-artifacts/lvs-tester.drc.lyrdb",
      "role": "native-artifact",
      "sha256": "205d85acb90e313a36565feb231953b9b33a96a471ff9ce3f4a12a9dd1840104",
      "source_output": "failing-drc-lyrdb",
      "source_step": "drc-fail"
    },
    {
      "bytes": 12218,
      "replay_id": null,
      "repository_path": "conformance/ihp-inverter/semantic-artifacts/lvs-tester.drc.lyrdb.openada.log",
      "role": "native-artifact",
      "sha256": "e7e7c888c6a870208248987811ebdc0f78137ec64a5a6ca37a066d6e80a7c3d1",
      "source_output": "failing-drc-transcript",
      "source_step": "drc-fail"
    },
    {
      "bytes": 12824,
      "replay_id": null,
      "repository_path": "conformance/ihp-inverter/semantic-artifacts/lvs.json",
      "role": "native-artifact",
      "sha256": "a61ad97f2cf573aef60956e4bb38fcc40302ea967c4a4039f8dc6111804a766d",
      "source_output": "lvs-result",
      "source_step": "lvs-match"
    },
    {
      "bytes": 1598,
      "replay_id": null,
      "repository_path": "conformance/ihp-inverter/semantic-artifacts/inverter.lvs.comp",
      "role": "native-artifact",
      "sha256": "6df6dab97e8ee40587f4a37f10cd82364e3088b6a8b33b80b691cf214380e906",
      "source_output": "lvs-comparison-report",
      "source_step": "lvs-match"
    },
    {
      "bytes": 578,
      "replay_id": null,
      "repository_path": "conformance/ihp-inverter/semantic-artifacts/inverter.lvs.json",
      "role": "native-artifact",
      "sha256": "d0fe4e41e1e70342dec83bd439eacdf6e49c0577334e9728f1147fe26b47390b",
      "source_output": "lvs-native-json",
      "source_step": "lvs-match"
    },
    {
      "bytes": 6115,
      "replay_id": null,
      "repository_path": "conformance/ihp-inverter/semantic-artifacts/inverter.lvs.comp.openada.log",
      "role": "native-artifact",
      "sha256": "fdd3b097f9debc0c6c8d3327da28d52031397cffed4a4be9f14cce4ef3c7bddd",
      "source_output": "lvs-transcript",
      "source_step": "lvs-match"
    },
    {
      "bytes": 5089,
      "replay_id": null,
      "repository_path": "conformance/ihp-inverter/semantic-oracle.json",
      "role": "independent-oracle",
      "sha256": "90f519bb4ad986b81b7d0f3b3a6caff31eb35a6c606b0c0c23722e2fe3b1e866",
      "source_output": "independent-oracle-verdict",
      "source_step": "independent-verifier"
    },
    {
      "bytes": 30164,
      "replay_id": null,
      "repository_path": "conformance/ihp-inverter/semantic-normalized.json",
      "role": "normalized-evidence",
      "sha256": "170a81738a222012b80db51060fb3fdfb9e2a7a459ecd7d4b1e9f3e3b24d7fd1",
      "source_output": "normalized-physical-evidence",
      "source_step": "normalize-physical-evidence"
    },
    {
      "bytes": 4593,
      "replay_id": null,
      "repository_path": "conformance/ihp-inverter/semantic-decision.json",
      "role": "downstream-decision",
      "sha256": "dd44d0d41439eb71afe50e1da854ed887311866f39d65578337b74f2f43e9985",
      "source_output": "downstream-physical-decision",
      "source_step": "engineering-decision"
    },
    {
      "bytes": 32867,
      "replay_id": null,
      "repository_path": "conformance/ihp-inverter/semantic-evidence.json",
      "role": "agent-visible-evidence",
      "sha256": "b16164116c45c4cb089afb2f5bfe47243978c769fa6931b935f234316f62b86e",
      "source_output": "agent-visible-physical-evidence",
      "source_step": "agent-evidence"
    },
    {
      "bytes": 1266,
      "replay_id": "real-gallery-drc-fail",
      "repository_path": "conformance/ihp-inverter/semantic-replays/real-gallery-drc-fail.json",
      "role": "negative-replay",
      "sha256": "d03c61ebc2b564cc7c774e3010f31a0e12c2907e81bf807fab1bcf507ba0446d",
      "source_output": null,
      "source_step": null
    },
    {
      "bytes": 1223,
      "replay_id": "synthetic-native-lvs-mismatch",
      "repository_path": "conformance/ihp-inverter/semantic-replays/synthetic-native-lvs-mismatch.json",
      "role": "negative-replay",
      "sha256": "1c58e89d2c5ac1ba8d03218370e453414fa56b48eea1b8a1808b67fdbc8cfe26",
      "source_output": null,
      "source_step": null
    },
    {
      "bytes": 1133,
      "replay_id": "reconciled-seven-item-drc",
      "repository_path": "conformance/ihp-inverter/semantic-replays/reconciled-seven-item-drc.json",
      "role": "tamper-replay",
      "sha256": "1618a3168da07a5a515e8f2753fd1a68bb538aaddf27690af9d8605161f087d9",
      "source_output": null,
      "source_step": null
    },
    {
      "bytes": 1289,
      "replay_id": "unbound-native-lvs-json",
      "repository_path": "conformance/ihp-inverter/semantic-replays/unbound-native-lvs-json.json",
      "role": "tamper-replay",
      "sha256": "6223cd204551044c091351e25c1fb19ac454352e01d22a693bbd0bfbcc40e3f0",
      "source_output": null,
      "source_step": null
    }
  ],
  "chain_id": "openada.chain/ihp-inverter-physical/v1",
  "chain_manifest_sha256": "7dfed09b24e23219d5ebe9f7a2d3601342126cf7bfec3e5ee0bc473eaf1ec830",
  "checks": {
    "agent_visible_evidence": true,
    "contract_test": true,
    "downstream_decision": true,
    "independent_artifact_check": true,
    "native_run": true,
    "negative_replay": true,
    "normalized_evidence": true,
    "pinned_real_design": true,
    "tamper_replay": true
  },
  "extensions": {
    "org.openada.physical": {
      "decision_scope": "engineering proceed/block; not foundry signoff",
      "receipt_status": "release"
    }
  },
  "schema": "openada.semantic-chain-run/v0alpha1",
  "semantic_subject_sha256": "0229af949b527475d92606ef5ec3d99c33a0ae3463158065571f333e4c93f273",
  "source_attestation": {
    "clean_after": true,
    "clean_before": true,
    "extensions": {},
    "receipt_class": "release",
    "repository_revision": "e8eec72051da74b7ef0546af64a4cdc160da51c4",
    "repository_tree": "6ebdabd7b9d17077e18c7f03bb91af4916d1d90f",
    "semantic_subject_sha256": "0229af949b527475d92606ef5ec3d99c33a0ae3463158065571f333e4c93f273",
    "state_unchanged": true
  },
  "status": "pass"
}
